date,cash_before,cash_after,shares_context,sanity_passed,sanity_error_count,side,size,signal_confidence,trade_executed,trade_reason,entry_date,exit_date,entry_price,exit_price,net_return,pnl,daily_output,discussion,bull_rounds,bear_rounds
2025-11-26,100000.0,100000.0,0.0,True,0,NO_TRADE,0.0,0.5,False,manager_decision=require_manual,,,,,0.0,0.0,backtesting/reports/day_by_day_TSLA_2025-10-01_to_2026-01-31/daily_outputs/TSLA_2025-11-26.json,"Tesla Inc (TSLA) maintains a strong market position in electric vehicles and energy storage, with robust financials and analyst optimism despite recent quarterly earnings declines. The company's focus on innovation and sustainability positions it well for future growth.

Tesla faces significant risks despite recent analyst optimism, including competition, margin pressures, and operational challenges.",3,3
2025-11-28,100000.0,100000.0,0.0,True,0,NO_TRADE,0.0,5.0,False,manager_decision=require_manual,,,,,0.0,0.0,backtesting/reports/day_by_day_TSLA_2025-10-01_to_2026-01-31/daily_outputs/TSLA_2025-11-28.json,"Tesla Inc. (TSLA) maintains a strong market position and innovative capabilities despite recent financial challenges. Analysts project modest growth with a target price of $421.73, and the company's advancements in battery technology and energy storage solutions position it for long-term success. However, risks such as competition and regulatory pressures must be considered.

Tesla faces significant risks despite recent innovations, including competition, regulatory pressures, and financial metrics showing cautious growth. Analyst target prices suggest upside, but these are based on optimistic projections that may not materialize given the company's recent performance and challenges.",3,3
2025-12-01,100000.0,100000.0,0.0,True,0,NO_TRADE,0.0,5.0,False,manager_decision=require_manual,,,,,0.0,0.0,backtesting/reports/day_by_day_TSLA_2025-10-01_to_2026-01-31/daily_outputs/TSLA_2025-12-01.json,"Tesla Inc maintains a strong position in the electric vehicle market with a diverse product portfolio and technological innovation, despite challenges in financial metrics and valuation. The upcoming earnings report and market dynamics will be key factors, but the company's fundamentals and market leadership suggest continued growth potential.

Tesla Inc faces a challenging technical outlook with bearish indicators, declining financial metrics, and a high valuation multiple, despite strengths in market leadership and technological innovation.",3,3
2025-12-02,100000.0,100000.0,0.0,True,0,NO_TRADE,0.0,0.5,False,trader_proposal.side=NO_TRADE,,,,,0.0,0.0,backtesting/reports/day_by_day_TSLA_2025-10-01_to_2026-01-31/daily_outputs/TSLA_2025-12-02.json,"Tesla Inc. (TSLA) maintains a strong market position with innovative electric vehicle and energy storage products, despite recent quarterly earnings declines. The company's fundamentals show a market cap of $1.54 trillion, solid profit and operating margins, and an analyst target price of $421.73, indicating potential for future growth. Tesla continues to lead in the electric vehicle and clean energy sector, with a resilient business model that can withstand macroeconomic pressures and competitive dynamics.

Tesla faces mixed signals with strong fundamentals but declining earnings and valuation concerns.",3,3
2025-12-03,100000.0,100000.0,0.0,True,0,NO_TRADE,0.0,0.8,False,trader_proposal.side=NO_TRADE,,,,,0.0,0.0,backtesting/reports/day_by_day_TSLA_2025-10-01_to_2026-01-31/daily_outputs/TSLA_2025-12-03.json,"Tesla continues to show strong leadership in the electric vehicle market with solid financials, despite recent challenges. Analyst target prices remain elevated, and the company's innovation in renewable energy and autonomous driving presents significant growth opportunities.

Tesla faces downward pressure with declining EPS, revenue growth, and negative operating margin trends, despite strong analyst target prices and market leadership.",3,3
2025-12-04,100000.0,100000.0,0.0,True,0,NO_TRADE,0.0,5.0,False,trader_proposal.side=NO_TRADE,,,,,0.0,0.0,backtesting/reports/day_by_day_TSLA_2025-10-01_to_2026-01-31/daily_outputs/TSLA_2025-12-04.json,"Tesla Inc continues to demonstrate resilience with strong technical indicators, dominant market position in electric vehicles, steady profitability, and innovative product developments despite recent market volatility. The company's fundamentals remain robust with positive analyst sentiment and potential for growth.

Tesla Inc faces challenges including declining quarterly earnings, high valuation, competitive pressures, and mixed analyst sentiment, despite strengths in market position and innovation.",3,3
2025-12-05,100000.0,100000.0,0.0,True,0,NO_TRADE,0.0,0.5,False,manager_decision=require_manual,,,,,0.0,0.0,backtesting/reports/day_by_day_TSLA_2025-10-01_to_2026-01-31/daily_outputs/TSLA_2025-12-05.json,"Tesla Inc. maintains a strong market position with high market capitalization and innovative products, supported by analyst target prices above current levels. Despite challenges, the company's diverse revenue streams and resilience in the face of market volatility indicate potential for continued growth.

Tesla faces downward pressure with declining earnings, high valuation, and execution risks despite positive sentiment from target prices.",3,3
2025-12-08,100000.0,100000.0,0.0,True,0,NO_TRADE,0.0,0.5,False,manager_decision=require_manual,,,,,0.0,0.0,backtesting/reports/day_by_day_TSLA_2025-10-01_to_2026-01-31/daily_outputs/TSLA_2025-12-08.json,"Tesla presents strong long-term growth potential with innovative technologies, despite recent challenges. Analyst optimism, positive sentiment, and target price hikes outweigh current negatives.

Tesla faces significant challenges including recent declines in quarterly earnings and revenue, high valuation metrics, and increasing competition in the EV market, despite some positive factors like strong analyst targets.",3,3
2025-12-09,100000.0,100000.0,0.0,True,0,NO_TRADE,0.0,0.0,False,trader_proposal.side=NO_TRADE,,,,,0.0,0.0,backtesting/reports/day_by_day_TSLA_2025-10-01_to_2026-01-31/daily_outputs/TSLA_2025-12-09.json,"Despite recent challenges, Tesla's strong market position, technological leadership, and upcoming catalysts such as the earnings report and potential product launches position the company for long-term growth.

Tesla faces a challenging technical position with bearish indicators, declining revenue, and valuation risks despite strong market position.",3,3
2025-12-10,100000.0,100000.0,0.0,True,0,NO_TRADE,0.0,0.0,False,manager_decision=require_manual,,,,,0.0,0.0,backtesting/reports/day_by_day_TSLA_2025-10-01_to_2026-01-31/daily_outputs/TSLA_2025-12-10.json,"Tesla's long-term prospects in battery technology and energy storage are strong, with analysts projecting a target price of $421.73. Despite recent quarterly declines, the company's innovation and market position support continued growth.

Tesla faces headwinds with recent earnings declines and bearish technical indicators, despite positive analyst sentiment and target prices.",3,3
2025-12-11,100000.0,100000.0,0.0,True,0,NO_TRADE,0.0,0.5,False,manager_decision=require_manual,,,,,0.0,0.0,backtesting/reports/day_by_day_TSLA_2025-10-01_to_2026-01-31/daily_outputs/TSLA_2025-12-11.json,"Tesla maintains strong market position and profitability despite recent challenges. Analysts and news sources indicate potential upside with target prices significantly above current levels.

Tesla faces a challenging market position with declining price trends and slowing revenue growth, despite strengths in EV leadership and profitability.",3,3
2025-12-12,100000.0,100000.0,0.0,True,0,NO_TRADE,0.0,0.5,False,manager_decision=require_manual,,,,,0.0,0.0,backtesting/reports/day_by_day_TSLA_2025-10-01_to_2026-01-31/daily_outputs/TSLA_2025-12-12.json,"Tesla maintains a strong market position with a high analyst target price, despite recent quarterly declines. The company's fundamentals show profitability and diversified revenue streams, though it faces competitive pressures and valuation concerns.

Tesla faces competitive pressures, valuation concerns, and execution risks despite strong market position and analyst optimism.",3,3
2025-12-15,100000.0,100000.0,0.0,True,0,NO_TRADE,0.0,0.0,False,trader_proposal.side=NO_TRADE,,,,,0.0,0.0,backtesting/reports/day_by_day_TSLA_2025-10-01_to_2026-01-31/daily_outputs/TSLA_2025-12-15.json,"Tesla's advancements in autonomous driving and regulatory support position it for sustained growth despite competition.

Tesla faces significant risks despite recent advancements, including increased competition, supply chain challenges, and regulatory hurdles.",3,3
2025-12-16,100000.0,100000.0,0.0,True,0,NO_TRADE,0.0,0.5,False,manager_decision=require_manual,,,,,0.0,0.0,backtesting/reports/day_by_day_TSLA_2025-10-01_to_2026-01-31/daily_outputs/TSLA_2025-12-16.json,"Tesla is in a strong position with positive sentiment from regulatory advancements, market speculation, and renewable energy expansion, outweighing the competition and supply chain challenges.

Tesla faces significant risks despite positive sentiment indicators, including competition, supply chain vulnerabilities, and market volatility.",3,3
2025-12-17,100000.0,100000.0,0.0,True,0,NO_TRADE,0.0,5.0,False,manager_decision=require_manual,,,,,0.0,0.0,backtesting/reports/day_by_day_TSLA_2025-10-01_to_2026-01-31/daily_outputs/TSLA_2025-12-17.json,"Tesla remains a strong long-term investment despite current risks, driven by innovation and market leadership.

Tesla faces significant risks including competition, regulatory challenges, and valuation concerns, despite some positive indicators.",3,3
2025-12-18,100000.0,100000.0,0.0,True,0,NO_TRADE,0.0,0.9,False,trader_proposal.side=NO_TRADE,,,,,0.0,0.0,backtesting/reports/day_by_day_TSLA_2025-10-01_to_2026-01-31/daily_outputs/TSLA_2025-12-18.json,"Tesla's innovative technology and market leadership in electric vehicles position it for sustained growth despite challenges.

Tesla faces regulatory hurdles, market competition, and bearish technical indicators, suggesting continued downward pressure on stock performance.",3,3
2025-12-19,100000.0,100000.0,0.0,True,0,NO_TRADE,0.0,5.0,False,manager_decision=require_manual,,,,,0.0,0.0,backtesting/reports/day_by_day_TSLA_2025-10-01_to_2026-01-31/daily_outputs/TSLA_2025-12-19.json,"Tesla's long-term prospects remain strong despite current challenges, driven by innovation, market leadership, and resilience.

Tesla remains a strong investment despite recent challenges, supported by innovation, market leadership, and upcoming product launches.",3,3
2025-12-22,100000.0,100000.0,0.0,True,0,NO_TRADE,0.0,5.0,False,trader_proposal.side=NO_TRADE,,,,,0.0,0.0,backtesting/reports/day_by_day_TSLA_2025-10-01_to_2026-01-31/daily_outputs/TSLA_2025-12-22.json,"Tesla's stock is expected to perform well in the near term, driven by strong cash flow and potential market share gains, despite regulatory and competitive risks.

Tesla's stock faces a bearish outlook due to upcoming challenges including a recall and declining EV demand, despite some supportive factors.",3,3
2025-12-23,100000.0,100000.0,0.0,True,0,NO_TRADE,0.0,0.5,False,trader_proposal.side=NO_TRADE,,,,,0.0,0.0,backtesting/reports/day_by_day_TSLA_2025-10-01_to_2026-01-31/daily_outputs/TSLA_2025-12-23.json,"Despite recent bearish sentiment and technical indicators, Tesla possesses strong long-term fundamentals and innovative capabilities that can drive future growth.

Tesla faces bearish technical indicators, concerns over fourth-quarter earnings, and overall market sentiment turning bearish. Strong fundamentals may not offset immediate risks.",3,3
2025-12-24,100000.0,100000.0,0.0,True,0,NO_TRADE,0.0,5.0,False,manager_decision=require_manual,,,,,0.0,0.0,backtesting/reports/day_by_day_TSLA_2025-10-01_to_2026-01-31/daily_outputs/TSLA_2025-12-24.json,"Tesla continues to innovate in electric vehicles, energy storage, and autonomous driving, despite regulatory and competitive challenges.

Tesla faces significant regulatory challenges, increased competition, and operational inefficiencies despite advancements in technology, leading to potential risks for sustained growth.",3,3
2025-12-26,100000.0,100000.0,0.0,True,0,NO_TRADE,0.0,5.0,False,manager_decision=require_manual,,,,,0.0,0.0,backtesting/reports/day_by_day_TSLA_2025-10-01_to_2026-01-31/daily_outputs/TSLA_2025-12-26.json,"Despite near-term concerns, Tesla's long-term growth potential remains strong due to its leadership in electric vehicles, AI, and sustainable energy, supported by strong fundamentals, positive innovations, and improving market sentiment.

Tesla faces near-term headwinds with declining momentum, concerns over production targets and new model launches, despite long-term potential in electric vehicles and AI.",3,3
2025-12-29,100000.0,100000.0,0.0,True,0,NO_TRADE,0.0,0.5,False,trader_proposal.side=NO_TRADE,,,,,0.0,0.0,backtesting/reports/day_by_day_TSLA_2025-10-01_to_2026-01-31/daily_outputs/TSLA_2025-12-29.json,"Tesla's market dominance, technological advancements, and resilient stock performance despite challenges indicate a bullish outlook.

Tesla faces regulatory challenges, product recalls, and market competition, despite its technological advancements and market dominance.",3,3
2025-12-30,100000.0,100000.0,0.0,True,0,NO_TRADE,0.0,0.5,False,trader_proposal.side=NO_TRADE,,,,,0.0,0.0,backtesting/reports/day_by_day_TSLA_2025-10-01_to_2026-01-31/daily_outputs/TSLA_2025-12-30.json,"Tesla remains a compelling investment despite challenges, driven by innovation, market leadership, and strong financials.

Tesla remains a strong investment due to innovation, market leadership, and positive momentum.",3,3
2025-12-31,100000.0,100000.0,0.0,True,0,NO_TRADE,0.0,0.0,False,manager_decision=require_manual,,,,,0.0,0.0,backtesting/reports/day_by_day_TSLA_2025-10-01_to_2026-01-31/daily_outputs/TSLA_2025-12-31.json,"Tesla's advancements in AI and autonomous driving, along with strong technical indicators, outweigh the regulatory and competitive challenges.

Tesla faces significant regulatory and competitive risks despite technological advancements.",3,3
2026-01-02,100000.0,100000.0,0.0,True,0,NO_TRADE,0.0,0.0,False,trader_proposal.side=NO_TRADE,,,,,0.0,0.0,backtesting/reports/day_by_day_TSLA_2025-10-01_to_2026-01-31/daily_outputs/TSLA_2026-01-02.json,"Tesla's strategic shift towards energy storage and renewable partnerships positions it for long-term growth, despite recent regulatory and market challenges.

Tesla faces multiple challenges including regulatory hurdles, negative market reaction to strategic shifts, and mixed social sentiment, despite recent partnerships.",3,3
2026-01-05,100000.0,100000.0,0.0,True,0,NO_TRADE,0.0,5.0,False,manager_decision=require_manual,,,,,0.0,0.0,backtesting/reports/day_by_day_TSLA_2025-10-01_to_2026-01-31/daily_outputs/TSLA_2026-01-05.json,"Tesla's growth is supported by strong innovation, brand loyalty, and strategic advancements in AI and energy solutions, despite facing challenges. The company's fundamentals and market momentum indicate a resilient position in the evolving market landscape.

Tesla faces significant risks including competition, regulatory challenges, and leadership uncertainty, which could undermine its growth trajectory despite positive sentiment.",3,3
2026-01-06,100000.0,100000.0,0.0,True,0,NO_TRADE,0.0,0.5,False,manager_decision=require_manual,,,,,0.0,0.0,backtesting/reports/day_by_day_TSLA_2025-10-01_to_2026-01-31/daily_outputs/TSLA_2026-01-06.json,"Tesla's recent earnings demonstrate strong delivery performance and energy storage growth, supported by autonomous driving advancements and gigafactory expansions.

Tesla's recent performance, while showing strong earnings and expansion plans, masks underlying issues in delivery targets, supply chain, and regulatory challenges, leading to a bearish outlook.",3,3
2026-01-07,100000.0,100000.0,0.0,True,0,NO_TRADE,0.0,0.0,False,trader_proposal.side=NO_TRADE,,,,,0.0,0.0,backtesting/reports/day_by_day_TSLA_2025-10-01_to_2026-01-31/daily_outputs/TSLA_2026-01-07.json,"Tesla remains a strong contender in the electric vehicle market, with innovation and brand loyalty driving future growth.

Tesla faces regulatory challenges and competitive pressures, with fundamentals suggesting potential disruptions to its growth trajectory despite recent innovations.",3,3
2026-01-08,100000.0,100000.0,0.0,True,0,NO_TRADE,0.0,0.0,False,manager_decision=require_manual,,,,,0.0,0.0,backtesting/reports/day_by_day_TSLA_2025-10-01_to_2026-01-31/daily_outputs/TSLA_2026-01-08.json,"Tesla is positioned to capitalize on the electric vehicle revolution and AI advancements, despite facing competition and regulatory headwinds.

Tesla is expected to benefit from the electric vehicle market growth and AI advancements, despite competition and regulatory challenges.",3,3
2026-01-09,100000.0,100000.0,0.0,True,0,NO_TRADE,0.0,0.0,False,manager_decision=require_manual,,,,,0.0,0.0,backtesting/reports/day_by_day_TSLA_2025-10-01_to_2026-01-31/daily_outputs/TSLA_2026-01-09.json,"Tesla's upcoming AI Day event and positive catalysts in the EV sector are expected to drive growth, despite competitive pressures and regulatory scrutiny.

Tesla faces increased competitive pressures and regulatory scrutiny, with upcoming events like AI Day being offset by market risks.",3,3
2026-01-12,100000.0,100000.0,0.0,True,0,NO_TRADE,0.0,0.5,False,trader_proposal.side=NO_TRADE,,,,,0.0,0.0,backtesting/reports/day_by_day_TSLA_2025-10-01_to_2026-01-31/daily_outputs/TSLA_2026-01-12.json,"Tesla's resilience in the face of regulatory challenges and production hurdles underscores its position as a leader in the EV market. The company's strong cash flow and innovative advancements in sustainable energy provide a solid foundation for future growth, despite current obstacles.

Tesla faces regulatory challenges and production delays that could hinder its growth, despite strong cash flow and positive sentiment in sustainable energy.",3,3
2026-01-13,100000.0,100000.0,0.0,True,0,NO_TRADE,0.0,5.0,False,manager_decision=require_manual,,,,,0.0,0.0,backtesting/reports/day_by_day_TSLA_2025-10-01_to_2026-01-31/daily_outputs/TSLA_2026-01-13.json,"Tesla's stock is expected to benefit from strong demand for electric vehicles and advancements in battery technology, despite regulatory and supply chain challenges. The company's leadership in autonomous driving technology and potential for market growth in the EV sector support a bullish stance.

Tesla faces multiple risks including high valuation, regulatory challenges, and supply chain issues, despite potential for growth in the EV sector.",3,3
2026-01-14,100000.0,100000.0,0.0,True,0,NO_TRADE,0.0,0.5,False,trader_proposal.side=NO_TRADE,,,,,0.0,0.0,backtesting/reports/day_by_day_TSLA_2025-10-01_to_2026-01-31/daily_outputs/TSLA_2026-01-14.json,"Tesla remains a leader in innovation and possesses strong financial resilience despite increased competition, with counterarguments addressing market competition and earnings concerns.

Tesla faces increased competition, delivery challenges, and regulatory issues which threaten its market leadership and profitability.",3,3
2026-01-15,100000.0,100000.0,0.0,True,0,NO_TRADE,0.0,5.0,False,trader_proposal.side=NO_TRADE,,,,,0.0,0.0,backtesting/reports/day_by_day_TSLA_2025-10-01_to_2026-01-31/daily_outputs/TSLA_2026-01-15.json,"Tesla remains resilient despite challenges, with strong growth in energy storage and AI integration offsetting competitive pressures.

Tesla faces increased competition and regulatory challenges in the electric vehicle market, with declining deliveries and challenges in energy storage and AI integration.",3,3
2026-01-16,100000.0,100000.0,0.0,True,0,NO_TRADE,0.0,0.5,False,manager_decision=require_manual,,,,,0.0,0.0,backtesting/reports/day_by_day_TSLA_2025-10-01_to_2026-01-31/daily_outputs/TSLA_2026-01-16.json,"Tesla's recent advancements in autonomous driving and new EV model, along with positive technical indicators, suggest strong potential for future growth despite challenges.

Tesla faces significant risks despite recent advancements, including supply chain issues, declining demand, and market volatility, outweighing the positive aspects of new models and technical indicators.",3,3
2026-01-20,100000.0,100000.0,0.0,True,0,NO_TRADE,0.0,0.0,False,manager_decision=require_manual,,,,,0.0,0.0,backtesting/reports/day_by_day_TSLA_2025-10-01_to_2026-01-31/daily_outputs/TSLA_2026-01-20.json,"Tesla's advancements in battery technology and autonomous driving, coupled with strong market sentiment, position the stock for continued growth despite regulatory and competitive challenges.

Tesla's advancements in battery technology and autonomous driving, along with strong market sentiment, position the stock for continued growth despite regulatory and competitive challenges.",3,3
2026-01-21,100000.0,100000.0,0.0,True,0,NO_TRADE,0.0,0.0,False,manager_decision=require_manual,,,,,0.0,0.0,backtesting/reports/day_by_day_TSLA_2025-10-01_to_2026-01-31/daily_outputs/TSLA_2026-01-21.json,"Tesla maintains a strong position in electric vehicle technology and energy storage, with recent innovations and resilience despite challenges in production and valuation.

Tesla faces mixed signals with positive innovation but challenges in production, profitability, and valuation.",3,3
2026-01-22,100000.0,100000.0,0.0,True,0,NO_TRADE,0.0,50.0,False,manager_decision=require_manual,,,,,0.0,0.0,backtesting/reports/day_by_day_TSLA_2025-10-01_to_2026-01-31/daily_outputs/TSLA_2026-01-22.json,"Tesla continues to demonstrate strong innovation and market leadership in the electric vehicle space, supported by robust financials and positive sentiment despite competitive pressures.

Tesla faces strong competitive pressures and profitability concerns despite recent market enthusiasm.",3,3
