date,cash_before,cash_after,shares_context,sanity_passed,sanity_error_count,side,size,signal_confidence,trade_executed,trade_reason,entry_date,exit_date,entry_price,exit_price,net_return,pnl,daily_output,discussion,bull_rounds,bear_rounds
2025-10-01,100000.0,100000.0,0.0,True,0,NO_TRADE,0.0,0.0,False,manager_decision=require_manual,,,,,0.0,0.0,backtesting/reports/day_by_day_TSLA_2025-10-01_to_2026-01-31/daily_outputs/TSLA_2025-10-01.json,"Tesla (TSLA) demonstrates strong long-term prospects despite near-term challenges, supported by technological leadership, expanding energy business, and analyst optimism. The company's ability to innovate and capture global markets positions it for sustained growth.

Tesla (TSLA) has strong long-term prospects due to its technological leadership, expanding energy business, and increasing global market share, supported by analyst optimism.",3,3
2025-10-02,100000.0,100000.0,0.0,True,0,NO_TRADE,0.0,0.0,False,manager_decision=require_manual,,,,,0.0,0.0,backtesting/reports/day_by_day_TSLA_2025-10-01_to_2026-01-31/daily_outputs/TSLA_2025-10-02.json,"Tesla's financial performance shows slight decline, but strong brand, innovative capabilities, and analyst target prices suggest potential growth. The company maintains a strong position in electric vehicles and clean energy, with opportunities despite challenges.

Tesla faces ongoing financial pressures despite its market position, with declining earnings and revenue, challenging competitive landscape, and risks from macroeconomic factors. While brand strength and innovation exist, they are offset by financial instability and analyst downward revisions.",3,3
2025-10-03,100000.0,100000.0,0.0,True,0,NO_TRADE,0.0,0.5,False,manager_decision=require_manual,,,,,0.0,0.0,backtesting/reports/day_by_day_TSLA_2025-10-01_to_2026-01-31/daily_outputs/TSLA_2025-10-03.json,"Tesla maintains a strong market position in electric vehicles and energy storage, with robust financials and high analyst optimism despite recent challenges.

Tesla's strong market position is challenged by declining earnings and revenue growth, high P/E ratio, and reliance on premium pricing.",3,3
2025-10-06,100000.0,100000.0,0.0,True,0,NO_TRADE,0.0,5.0,False,manager_decision=require_manual,,,,,0.0,0.0,backtesting/reports/day_by_day_TSLA_2025-10-01_to_2026-01-31/daily_outputs/TSLA_2025-10-06.json,"Tesla maintains a strong market position with dominant electric vehicle and energy storage leadership, despite recent financial challenges.

Tesla maintains a strong market position but faces significant headwinds from financial performance, valuation concerns, competitive pressures, and operational risks.",3,3
2025-10-07,100000.0,100000.0,0.0,True,0,NO_TRADE,0.0,0.5,False,manager_decision=require_manual,,,,,0.0,0.0,backtesting/reports/day_by_day_TSLA_2025-10-01_to_2026-01-31/daily_outputs/TSLA_2025-10-07.json,"Tesla maintains a strong market position in electric vehicles and renewable energy, supported by analyst optimism, strategic initiatives, and resilience despite recent financial headwinds.

Tesla faces challenges in maintaining growth amid declining quarterly earnings, revenue, and profitability concerns.",3,3
2025-10-08,100000.0,100000.0,0.0,True,0,NO_TRADE,0.0,0.0,False,trader_proposal.side=NO_TRADE,,,,,0.0,0.0,backtesting/reports/day_by_day_TSLA_2025-10-01_to_2026-01-31/daily_outputs/TSLA_2025-10-08.json,"Tesla (TSLA) remains a compelling investment despite recent challenges, with strong EV market leadership, innovative energy storage advancements, and analyst optimism outweighing valuation concerns.

Tesla faces significant valuation risks despite market leadership, with declining earnings, low profitability, and high P/E ratio.",3,3
2025-10-09,100000.0,100000.0,0.0,True,0,NO_TRADE,0.0,0.0,False,trader_proposal.side=NO_TRADE,,,,,0.0,0.0,backtesting/reports/day_by_day_TSLA_2025-10-01_to_2026-01-31/daily_outputs/TSLA_2025-10-09.json,"Despite recent financial headwinds, Tesla maintains a strong market position and innovative edge in EV technology and energy storage. Analyst target prices suggest potential upside, though risks remain.

Tesla faces significant challenges including declining financial metrics, competitive pressures, and elevated valuation despite analyst optimism.",3,3
2025-10-10,100000.0,100000.0,0.0,True,0,NO_TRADE,0.0,0.5,False,manager_decision=require_manual,,,,,0.0,0.0,backtesting/reports/day_by_day_TSLA_2025-10-01_to_2026-01-31/daily_outputs/TSLA_2025-10-10.json,"Tesla is expected to benefit from the growth in the electric vehicle market, with analysts providing strong buy recommendations and target prices above current levels. The company's diversification into energy storage and solar, along with its market leadership, supports a positive outlook despite recent mixed financial results.

Tesla faces mixed analyst views with target prices below current levels in some reports, despite positive sentiment on its market position and diversification. Financial metrics show modest profitability and cautious growth indicators.",3,3
2025-10-13,100000.0,100000.0,0.0,True,0,NO_TRADE,0.0,0.5,False,manager_decision=require_manual,,,,,0.0,0.0,backtesting/reports/day_by_day_TSLA_2025-10-01_to_2026-01-31/daily_outputs/TSLA_2025-10-13.json,"Tesla maintains a strong market position in electric vehicles and clean energy, with analysts projecting a strong buy consensus and target prices above current levels. Despite recent earnings declines, the company shows resilience and innovation in its core markets, supported by healthy profit margins and robust financials.

Tesla faces a mixed outlook with conflicting signals from technical indicators, declining earnings, and challenges in revenue growth, despite analyst optimism.",3,3
2025-10-14,100000.0,100000.0,0.0,True,0,NO_TRADE,0.0,0.0,False,trader_proposal.side=NO_TRADE,,,,,0.0,0.0,backtesting/reports/day_by_day_TSLA_2025-10-01_to_2026-01-31/daily_outputs/TSLA_2025-10-14.json,"Tesla (TSLA) is a leading electric vehicle and clean energy company with strong market position, profitability, and innovative capabilities. Despite recent challenges, the company maintains a competitive edge and long-term growth potential, supported by analyst recommendations and market trends.

Tesla faces challenges in earnings growth and revenue growth, high P/E ratio, and market uncertainties despite strong positions in electric vehicles and energy storage.",3,3
2025-10-15,100000.0,100000.0,0.0,True,0,NO_TRADE,0.0,0.5,False,manager_decision=require_manual,,,,,0.0,0.0,backtesting/reports/day_by_day_TSLA_2025-10-01_to_2026-01-31/daily_outputs/TSLA_2025-10-15.json,"Tesla's strong market position in the EV sector, positive analyst target prices, and resilience in the face of quarterly fluctuations support a bullish stance.

Tesla's strong market position and positive analyst targets are counterbalanced by bearish technical indicators, declining quarterly performance, and high valuation metrics.",3,3
2025-10-16,100000.0,100000.0,0.0,True,0,NO_TRADE,0.0,0.5,False,manager_decision=require_manual,,,,,0.0,0.0,backtesting/reports/day_by_day_TSLA_2025-10-01_to_2026-01-31/daily_outputs/TSLA_2025-10-16.json,"Tesla Inc. exhibits a strong potential for future growth despite current challenges, driven by leadership in EV and energy storage, technological innovation, and expanding market opportunities.

Tesla Inc. faces significant risks including profitability issues, high valuation metrics, and increasing competition, despite its strong market position in EV and energy storage sectors.",3,3
2025-10-17,100000.0,100000.0,0.0,True,0,NO_TRADE,0.0,0.5,False,manager_decision=require_manual,,,,,0.0,0.0,backtesting/reports/day_by_day_TSLA_2025-10-01_to_2026-01-31/daily_outputs/TSLA_2025-10-17.json,"Tesla exhibits strong innovation potential and maintains a dominant position in the electric vehicle market, supported by analyst optimism and future growth projections despite recent volatility.

Tesla faces mixed market conditions with recent volatility, negative quarterly earnings growth, and challenges in the competitive EV market despite strong brand loyalty and innovative products.",3,3
2025-10-20,100000.0,100000.0,0.0,True,0,NO_TRADE,0.0,0.3,False,manager_decision=require_manual,,,,,0.0,0.0,backtesting/reports/day_by_day_TSLA_2025-10-01_to_2026-01-31/daily_outputs/TSLA_2025-10-20.json,"Tesla is expected to maintain its leadership in the electric vehicle market, benefit from advancements in battery technology and autonomous driving, and diversify through energy storage and solar products. Analysts project recovery with a target price of $421.73, supported by strong financials and market confidence despite recent earnings misses.

Tesla faces mixed market conditions with recent earnings below expectations, despite strong analyst target prices reflecting cautious optimism.",3,3
2025-10-21,100000.0,100000.0,0.0,True,0,NO_TRADE,0.0,0.0,False,trader_proposal.side=NO_TRADE,,,,,0.0,0.0,backtesting/reports/day_by_day_TSLA_2025-10-01_to_2026-01-31/daily_outputs/TSLA_2025-10-21.json,"Tesla Inc. maintains a strong market position in electric vehicles and renewable energy, despite recent financial challenges. The company's innovation in battery technology and energy storage, along with analyst optimism and high market cap, positions it for long-term growth.

Tesla Inc. faces significant challenges including declining quarterly earnings, revenue, and profit margins, despite strengths in innovation and market position. The company's diversification into energy storage and solar is not enough to offset the core business issues, and the bear case remains strong.",3,3
2025-10-22,100000.0,100000.0,0.0,True,0,NO_TRADE,0.0,0.0,False,trader_proposal.side=NO_TRADE,,,,,0.0,0.0,backtesting/reports/day_by_day_TSLA_2025-10-01_to_2026-01-31/daily_outputs/TSLA_2025-10-22.json,"Tesla Inc. (TSLA) demonstrates strong resilience and growth potential in the electric vehicle market, supported by technological advancements, robust financials, and analyst optimism despite recent earnings challenges.

Tesla Inc. (TSLA) faces significant challenges despite recent advancements, including persistent quarterly earnings declines, market competition, and valuation concerns. Analyst target prices, while present, may not fully account for the risks in the cyclical consumer sector. The company's financial performance, while strong in some metrics, is hampered by revenue growth issues and high valuation metrics. The consensus leans towards caution due to these factors.",3,3
2025-10-23,100000.0,100000.0,0.0,True,0,NO_TRADE,0.0,0.0,False,trader_proposal.side=NO_TRADE,,,,,0.0,0.0,backtesting/reports/day_by_day_TSLA_2025-10-01_to_2026-01-31/daily_outputs/TSLA_2025-10-23.json,"Despite recent financial challenges, Tesla maintains strong market position, innovative capabilities, and growth opportunities in energy storage and autonomous driving. The company's fundamentals are supported by healthy margins and profitability, and the market shows cautious optimism with a target price of $421.73.

Tesla faces mixed signals with analyst target prices below current levels, deteriorating fundamentals including negative sentiment in key metrics and declining earnings, despite growth opportunities in energy storage and autonomous driving. The stock is considered overvalued with a high PE ratio, and technical resistance near the all-time high suggests potential for further declines.",3,3
2025-10-24,100000.0,100000.0,0.0,True,0,NO_TRADE,0.0,0.5,False,trader_proposal.side=NO_TRADE,,,,,0.0,0.0,backtesting/reports/day_by_day_TSLA_2025-10-01_to_2026-01-31/daily_outputs/TSLA_2025-10-24.json,"Tesla's long-term growth potential in electric vehicles and renewable energy, supported by innovation and market leadership, outweighs short-term challenges.

Tesla faces significant headwinds in the electric vehicle market, including competition, profitability challenges, and mixed technical indicators.",3,3
2025-10-27,100000.0,100000.0,0.0,True,0,NO_TRADE,0.0,0.5,False,manager_decision=require_manual,,,,,0.0,0.0,backtesting/reports/day_by_day_TSLA_2025-10-01_to_2026-01-31/daily_outputs/TSLA_2025-10-27.json,"Tesla faces short-term challenges but maintains strong long-term fundamentals, with analyst optimism and potential catalysts.

Tesla faces both short-term technical bearishness and long-term fundamental challenges, despite some analyst optimism.",3,3
2025-10-28,100000.0,100000.0,0.0,True,0,NO_TRADE,0.0,0.5,False,manager_decision=require_manual,,,,,0.0,0.0,backtesting/reports/day_by_day_TSLA_2025-10-01_to_2026-01-31/daily_outputs/TSLA_2025-10-28.json,"Tesla remains a leader in the electric vehicle market with strong brand presence and innovative capabilities, despite recent financial headwinds. Analysts maintain a positive target price, and the company's energy storage business shows promising growth.

Tesla faces significant headwinds with declining earnings, revenue growth challenges, and a stock trading below 52-week highs despite analyst optimism.",3,3
2025-10-29,100000.0,100000.0,0.0,True,0,NO_TRADE,0.0,0.5,False,trader_proposal.side=NO_TRADE,,,,,0.0,0.0,backtesting/reports/day_by_day_TSLA_2025-10-01_to_2026-01-31/daily_outputs/TSLA_2025-10-29.json,"Tesla Inc demonstrates strong market leadership in electric vehicles and clean energy, supported by robust fundamentals, positive analyst sentiment, and expansion into energy storage and solar. Despite recent earnings declines, the company's innovative capabilities and long-term prospects in sustainable energy and autonomous technology position it for future growth.

Tesla Inc faces significant challenges including recent revenue declines, negative quarterly earnings growth, and valuation concerns despite strong market position and expansion in energy storage.",3,3
2025-10-30,100000.0,100000.0,0.0,True,0,NO_TRADE,0.0,0.5,False,manager_decision=require_manual,,,,,0.0,0.0,backtesting/reports/day_by_day_TSLA_2025-10-01_to_2026-01-31/daily_outputs/TSLA_2025-10-30.json,"Tesla maintains a strong market position with high analyst target prices and positive forward catalysts, despite recent earnings headwinds.

Tesla faces mixed outlook with concerns over declining profit margins, negative quarterly earnings growth, and competition, despite positive forward catalysts.",3,3
2025-10-31,100000.0,100000.0,0.0,True,0,NO_TRADE,0.0,0.0,False,manager_decision=require_manual,,,,,0.0,0.0,backtesting/reports/day_by_day_TSLA_2025-10-01_to_2026-01-31/daily_outputs/TSLA_2025-10-31.json,"Tesla maintains strong market position and has expansion opportunities in energy storage and autonomous driving, despite mixed technical and fundamental signals.

Tesla faces mixed technical and fundamental signals, with price below key support levels and earnings risk.",3,3
2025-11-03,100000.0,100000.0,0.0,True,0,NO_TRADE,0.0,0.5,False,manager_decision=require_manual,,,,,0.0,0.0,backtesting/reports/day_by_day_TSLA_2025-10-01_to_2026-01-31/daily_outputs/TSLA_2025-11-03.json,"Tesla maintains a strong market position with robust growth in electric vehicles and energy storage, despite recent earnings declines. Analysts project a target price of $421.73, indicating potential upside. The company's fundamentals show profitability and resilience in core business segments, supported by positive sentiment in market cap and operational metrics.

Tesla faces a challenging market position despite recent performance, with high valuation metrics, declining profitability, and operational risks.",3,3
2025-11-04,100000.0,100000.0,0.0,True,0,NO_TRADE,0.0,0.0,False,manager_decision=require_manual,,,,,0.0,0.0,backtesting/reports/day_by_day_TSLA_2025-10-01_to_2026-01-31/daily_outputs/TSLA_2025-11-04.json,"Tesla faces near-term challenges in earnings and revenue growth, but has strong long-term potential driven by market leadership in EVs, AI, and energy storage, with a current trading below target prices.

Tesla faces near-term challenges in earnings and revenue growth, with valuation metrics indicating potential overvaluation despite trading below targets. The company's competitive pressures and financial metrics suggest a bearish outlook.",3,3
2025-11-05,100000.0,100000.0,0.0,True,0,NO_TRADE,0.0,0.0,False,trader_proposal.side=NO_TRADE,,,,,0.0,0.0,backtesting/reports/day_by_day_TSLA_2025-10-01_to_2026-01-31/daily_outputs/TSLA_2025-11-05.json,"Tesla (TSLA) presents a high-risk, high-reward investment opportunity with strong long-term potential despite short-term challenges.

Tesla faces significant headwinds with declining earnings, technical bearishness, and high valuation risks despite positive long-term factors.",3,3
2025-11-06,100000.0,100000.0,0.0,True,0,NO_TRADE,0.0,0.0,False,manager_decision=require_manual,,,,,0.0,0.0,backtesting/reports/day_by_day_TSLA_2025-10-01_to_2026-01-31/daily_outputs/TSLA_2025-11-06.json,"Tesla remains a strong investment despite near-term technical challenges, with fundamentals, analyst targets, and market position supporting long-term growth.

Tesla faces near-term technical weakness and headwinds despite strong fundamentals and analyst targets.",3,3
2025-11-07,100000.0,100000.0,0.0,True,0,NO_TRADE,0.0,0.5,False,manager_decision=require_manual,,,,,0.0,0.0,backtesting/reports/day_by_day_TSLA_2025-10-01_to_2026-01-31/daily_outputs/TSLA_2025-11-07.json,"Tesla Inc. (TSLA) is a leading electric vehicle and clean energy company with strong market position. Despite recent challenges, the company shows resilience with high analyst target prices and positive industry trends. Its technological leadership, brand strength, and expansion into energy storage and solar products provide diversification and potential for future growth.

Tesla faces significant challenges in the competitive EV market, including supply chain issues, declining earnings, and valuation concerns despite analyst optimism.",3,3
2025-11-10,100000.0,100000.0,0.0,True,0,NO_TRADE,0.0,0.5,False,trader_proposal.side=NO_TRADE,,,,,0.0,0.0,backtesting/reports/day_by_day_TSLA_2025-10-01_to_2026-01-31/daily_outputs/TSLA_2025-11-10.json,"Tesla Inc. (TSLA) maintains a strong market position in electric vehicles and energy storage, despite recent financial challenges. Analysts have a generally positive outlook with a Strong Buy recommendation from a small percentage and Buy from a majority. The company's innovation and brand loyalty drive future growth potential.

Tesla faces financial headwinds with declining earnings and revenue, high P/E ratio despite growth expectations, and competitive pressures in the EV market. While brand loyalty and innovation are strengths, they may not offset current financial weaknesses.",3,3
2025-11-11,100000.0,100000.0,0.0,True,0,NO_TRADE,0.0,0.5,False,manager_decision=require_manual,,,,,0.0,0.0,backtesting/reports/day_by_day_TSLA_2025-10-01_to_2026-01-31/daily_outputs/TSLA_2025-11-11.json,"Tesla maintains strong market position and innovation in key growth areas despite recent financial challenges.

Tesla maintains a strong market position in electric vehicles and energy storage, with positive long-term growth potential despite recent financial challenges.",3,3
2025-11-12,100000.0,100000.0,0.0,True,0,NO_TRADE,0.0,0.3,False,trader_proposal.side=NO_TRADE,,,,,0.0,0.0,backtesting/reports/day_by_day_TSLA_2025-10-01_to_2026-01-31/daily_outputs/TSLA_2025-11-12.json,"Tesla's strong market position in electric vehicles and energy storage, coupled with expansion into new markets and technological innovations, supports continued growth despite recent mixed financial results. The company's focus on sustainable energy and autonomous driving, along with strategic investments, positions it for long-term success.

Tesla's position is underpinned by strong EV leadership and energy storage, but faces profitability issues, revenue growth challenges, and market sentiment concerns.",3,3
2025-11-13,100000.0,100000.0,0.0,True,0,NO_TRADE,0.0,5.0,False,trader_proposal.side=NO_TRADE,,,,,0.0,0.0,backtesting/reports/day_by_day_TSLA_2025-10-01_to_2026-01-31/daily_outputs/TSLA_2025-11-13.json,"Tesla Inc (TSLA) is a leading electric vehicle and clean energy company with strong market position and fundamentals. Despite recent earnings challenges, the company maintains a healthy financial profile with solid margins and a high analyst target price, indicating potential for future growth. The stock shows signs of potential reversal with support near $230.26 and resistance at $250.68, suggesting upside potential.

Tesla faces earnings challenges, market competition, and mixed analyst sentiment despite strong long-term fundamentals.",3,3
2025-11-14,100000.0,100000.0,0.0,True,0,NO_TRADE,0.0,5.0,False,trader_proposal.side=NO_TRADE,,,,,0.0,0.0,backtesting/reports/day_by_day_TSLA_2025-10-01_to_2026-01-31/daily_outputs/TSLA_2025-11-14.json,"Tesla maintains a Strong Buy consensus from analysts despite mixed market sentiment.

Tesla maintains a Strong Buy consensus from analysts despite mixed market sentiment.",3,3
2025-11-17,100000.0,100000.0,0.0,True,0,NO_TRADE,0.0,0.0,False,manager_decision=require_manual,,,,,0.0,0.0,backtesting/reports/day_by_day_TSLA_2025-10-01_to_2026-01-31/daily_outputs/TSLA_2025-11-17.json,"Tesla maintains strong technological leadership and market position in electric vehicles, despite recent earnings challenges. The company's innovations in autonomous driving and energy storage, along with its brand strength, position it for long-term growth.

Tesla faces challenges in quarterly earnings growth and revenue growth, despite strong technological leadership and market position.",3,3
2025-11-18,100000.0,100000.0,0.0,True,0,NO_TRADE,0.0,0.0,False,manager_decision=require_manual,,,,,0.0,0.0,backtesting/reports/day_by_day_TSLA_2025-10-01_to_2026-01-31/daily_outputs/TSLA_2025-11-18.json,"Tesla maintains strong fundamentals with profitability, healthy margins, and a high market cap despite recent declines. Analysts remain optimistic with a strong buy recommendation and target price, supported by diversification into energy storage and solar, and market leadership in EV and clean energy sectors.

Tesla faces mixed sentiment with declining profitability, revenue growth, and high valuation metrics, despite strengths in brand loyalty and diversification. Analysts' optimism is tempered by recent underperformance and market competition.",3,3
2025-11-19,100000.0,100000.0,0.0,True,0,NO_TRADE,0.0,5.0,False,manager_decision=require_manual,,,,,0.0,0.0,backtesting/reports/day_by_day_TSLA_2025-10-01_to_2026-01-31/daily_outputs/TSLA_2025-11-19.json,"Tesla maintains a strong position in the electric vehicle market with leadership in battery storage technology and high brand loyalty, despite recent financial challenges.

Tesla maintains strong market position in electric vehicles and energy storage with innovative products and high brand loyalty, despite recent financial challenges.",3,3
2025-11-20,100000.0,100000.0,0.0,True,0,NO_TRADE,0.0,0.5,False,manager_decision=require_manual,,,,,0.0,0.0,backtesting/reports/day_by_day_TSLA_2025-10-01_to_2026-01-31/daily_outputs/TSLA_2025-11-20.json,"Tesla's strong brand loyalty, technological leadership, and expansion into energy storage and solar provide resilience despite current financial headwinds. Analysts maintain a high target price, reflecting potential for future growth.

Tesla faces multiple challenges including slowing growth, negative year-over-year financial performance, and intense competition, despite strengths in brand loyalty and technological leadership.",3,3
2025-11-21,100000.0,100000.0,0.0,True,0,NO_TRADE,0.0,0.0,False,trader_proposal.side=NO_TRADE,,,,,0.0,0.0,backtesting/reports/day_by_day_TSLA_2025-10-01_to_2026-01-31/daily_outputs/TSLA_2025-11-21.json,"Tesla's strong market position in electric vehicles and clean energy, coupled with high analyst target prices and innovative capabilities, outweighs current financial challenges.

Tesla faces significant challenges despite its market leadership, including declining quarterly earnings, high P/E ratio, and competitive pressures. Current financial metrics indicate caution, outweighing the potential upside from analyst target prices.",3,3
2025-11-24,100000.0,100000.0,0.0,True,0,NO_TRADE,0.0,0.7,False,trader_proposal.side=NO_TRADE,,,,,0.0,0.0,backtesting/reports/day_by_day_TSLA_2025-10-01_to_2026-01-31/daily_outputs/TSLA_2025-11-24.json,"Despite recent financial headwinds, Tesla's strong market position, innovation in electric vehicles and energy storage, and analyst support suggest significant growth potential.

Tesla faces significant challenges including recent financial headwinds, declining profit margins, negative quarterly earnings growth, and competitive pressures from BYD and traditional automakers.",3,3
2025-11-25,100000.0,100000.0,0.0,True,0,NO_TRADE,0.0,0.5,False,trader_proposal.side=NO_TRADE,,,,,0.0,0.0,backtesting/reports/day_by_day_TSLA_2025-10-01_to_2026-01-31/daily_outputs/TSLA_2025-11-25.json,"Tesla Inc. (TSLA) remains a strong investment opportunity despite recent financial challenges. The company's leadership in electric vehicles, innovative capabilities, and strong brand presence provide a solid foundation for future growth. Analyst target prices indicate potential upside, and while there are risks, they are outweighed by the company's strengths and market position.

Tesla Inc. (TSLA) faces significant risks including declining profit margins, negative quarterly earnings growth, increasing competition in the electric vehicle market, and regulatory pressures. While the company has strengths like brand strength and technological advancements, these challenges outweigh the potential upside indicated by analyst target prices.",3,3
